ticker	score	verdict	price	target	upside	moat	catalyst	risk_level	one_liner
COHR	65	HOLD	256	200	-22%	Strong	1.6T ramp + NVIDIA partnership	Medium	Best photonics portfolio for AI but priced beyond consensus; wait for pullback
LITE	70	HOLD	729	500	-31%	Very Strong	NVIDIA $2B deal + $8B revenue target	High	Laser chip king of AI optics; dominant but priced for perfection at 62x fwd P/E
AAOI	59	HOLD	101	70	-31%	Moderate	$200M+ 1.6T order + 3.5x DC rev growth	High	Under-discovered AI optics dark horse; US mfg moat, zero debt, but still unprofitable
FN	71	HOLD	506	450	-11%	Strong	NVIDIA sole-source 1.6T + 50% capacity expansion	Low	Best risk-adjusted AI photonics play; fortress balance sheet, agnostic winner
POET	35	AVOID	5.93	N/A	N/A	Speculative	Prototype demos H1 2026 + CPO optionality	Very High	Interesting tech but pre-revenue with extreme execution risk; revisit at >$10M quarterly rev
CIEN	69	HOLD	340	300	-12%	Strong	WL6e ramp + $5B backlog + margin expansion to 17%	Medium	Optical networking leader with $7.8B orders; wait for margin proof or pullback
LASR	49	AVOID	N/A	N/A	N/A	Moderate	Defense laser strength + AI photonics narrative	High	Defense laser co riding AI hype; no data center revenue to justify 13x sales valuation
VIAV	69	HOLD	33.73	30	-11%	Moderate-Strong	AI test demand + margin expansion + restructuring	Low	Under-discovered test & measurement play; cheapest AI photonics exposure at ~5x sales
MKSI	57	HOLD	N/A	N/A	N/A	Moderate	Semi capex cycle + Photonics division	Medium	Indirect AI photonics via semi equipment; reasonable value but not a targeted play
IPGP	45	AVOID	115	N/A	N/A	Moderate	Defense laser pivot + cyclical recovery	Medium	Industrial fiber laser leader but wrong market; no AI data center exposure
AXTI	47	AVOID	N/A	N/A	N/A	Strong but Fragile	InP capacity expansion July 2026	Very High	Owns 60-70% of InP substrate bottleneck but China mfg risk + unprofitable + extreme volatility
MTSI	76	BUY	255	300	+18%	Strong	Raised growth to 35-40% + 1.6T component ramp	Medium	Best under-discovered AI photonics name; 57% gross margins, analog IC moat, data center +48%
SIVE.ST	46	AVOID	N/A	N/A	N/A	Emerging	POET demos + O-Net ELS + LiDAR ramp Q4	Very High	InP DFB laser micro-cap; real tech, credible partners, but pre-profit and pre-scale
SOI.PA	65	HOLD	59	50	-15%	Very Strong	Tower 5x SiPh expansion + photonics-SOI €100M+	Medium	Hidden photonics monopoly at 2.7x sales; 70% SOI share but mobile weakness masks story
CRDO	82	BUY	100	170	+70%	Very Strong	53% pullback + 1.6T Bluebird DSP + 200G AEC	Medium-High	88% AEC monopoly, 68% GM, 200% growth, pulled back from $214; 67% customer concentration risk
TSEM	75	BUY	164	200	+22%	Very Strong	5x SiPh capacity + NVIDIA collab + margin expansion	Medium	85% SiPh foundry share; TSMC of photonics. $920M expansion 70%+ reserved. Soitec sole supplier.
5802.T	58	HOLD	9214	N/A	N/A	Moderate	EML demand + fiber buildout	Low	Japan conglomerate with EML/fiber exposure; not a pure play but cheap at 13-15x P/E
300308.SZ	79	BUY	579	700	+21%	Very Strong	1.6T 5x demand ramp + NVIDIA/Google dominance	High	World's largest transceiver co; 50%+ NVIDIA share, 43% GM, 28% net margin. Geopolitical risk.
ANET	83	BUY	131	175	+33%	Exceptional	AI rev +100% to $3.25B + 800G leadership	Low	Demand signal for all photonics; 64% GM, 43% OPM, $10.7B net cash, $4.25B FCF. Franchise.
300502.SZ	68	HOLD	N/A	N/A	N/A	Moderate-Strong	800G/1.6T ramp + NVIDIA #2 supplier	High	#2 Chinese transceiver co; +179% growth but $50B at 22x sales is steep vs Innolight
6503.T	55	HOLD	N/A	N/A	N/A	Strong in EML	3x optical capacity by FY28	Low	50% global EML share but buried in ¥5.5T conglomerate; Lumentum better for EML exposure
MRVL	79	BUY	88	120	+36%	Very Strong	Celestial AI + 1.6T Ara DSP + custom silicon ramp	Medium	Boldest photonic bet in semis; $3.25B Celestial AI + 50+ custom AI programs. $116 consensus.
GFS	62	HOLD	N/A	N/A	N/A	Moderate-Strong	SiPh doubling + AMF + China-free supply chain	Medium	#2 SiPh foundry; $200M→$1B SiPh target but legacy foundry drag. Cheap at 3.8x sales.
AVGO	85	BUY	323	430	+33%	Exceptional	AI rev +106% to $40.4B + $162B backlog + Taurus DSP	Low	Gorilla of AI networking; Tomahawk monopoly + XPU + optical DSP + SiPh. 68% EBITDA. $1.53T.
IQE.L	52	HOLD	N/A	N/A	N/A	Moderate	Strategic review + AI InP/GaAs demand recovery	High	UK compound semi epiwafer; potential acquisition target. Barely profitable. Monitor review outcome.
GLW	72	HOLD	140	120	-14%	Strong	Meta $6B deal + $10.3B scale-out by 2030 + optical +35%	Low	Fiber infrastructure backbone of AI; $6.3B optical rev, $1B profit. Near ATH, wait for pullback.
5803.T	68	HOLD	25600	N/A	N/A	Strong	3x US fiber output + AI demand	Low	Japanese Corning; +160% in 2025 on AI fiber. Near ATH, well-priced. Strong Buy consensus.
600487.SS	60	HOLD	N/A	N/A	N/A	Moderate	Fiber + optical packaging + CPO + liquid cooling	Medium	China #2 fiber + unique optical module packaging angle. Shanghai-listed.
4973.T	63	HOLD	5270	N/A	N/A	Strong Niche	Transceiver volume explosion → gold plating demand	Low	Hidden monopoly: 50% global gold plating share, 2.1x sales, 4.17% yield. 52 employees. Niche but real.
AEHR	48	AVOID	34.52	N/A	N/A	Moderate	SiPh burn-in orders + AI optical I/O	High	Niche SiPh wafer burn-in leader but $880M cap on $40M rev, unprofitable, declining margins.
0522.HK	66	HOLD	N/A	N/A	N/A	Strong	SiPh die bonding + TCB record + AI packaging	Medium	AMICRA owns photonic assembly chokepoint; diversified equipment co limits pure-play upside.
002475.SZ	60	HOLD	N/A	N/A	N/A	Moderate	Full-stack AI DC + optical 10G-1.6T + OpenAI supplier	Medium	$43B China manufacturing giant with optical transceiver ambitions; optical too small vs total rev.
HUBN.SW	58	HOLD	174	N/A	N/A	Moderate	Polatis OCS leader + OCS market → $2.5B by 2029	Medium	Swiss co owns leading OCS technology. $2.5B market emerging. Diversified dilution but early-mover.
002281.SZ	56	HOLD	79.15	N/A	N/A	Moderate	Chinese telecom + DC optical components	Medium	China #3 optical component co; broad portfolio but lacks NVIDIA/hyperscaler AI relationships.
CLS	74	HOLD	N/A	N/A	N/A	Strong	FY26 $17B guide + 55% custom switch share + CCS +40%	Low	Bigger Fabrinet: AI data center EMS at 0.7x sales. 55% custom Ethernet switch mfg share. Near BUY.
APH	78	BUY	N/A	N/A	~30%	Very Strong	Comms +78% + CommScope CCS $4.1B + 33% AI DC share	Low	Dominant AI data center connector company. $23.1B rev, 27.5% OPM record. Every rack uses Amphenol.
FORM	67	HOLD	N/A	N/A	N/A	Moderate-Strong	Keystone SiPh acquisition + $850M target model	Medium	SiPh wafer test infrastructure play. Keystone adds optical probing. Path to $850M revenue.
6146.T	72	HOLD	45300	N/A	N/A	Exceptional	AI chip volume + SiPh dicing + consumables recurring	Low	75% global dicing monopoly. 39% OPM. Every chip (including SiPh) needs Disco. Japanese hidden gem.
AEIS	65	HOLD	N/A	N/A	N/A	Moderate	DC Computing +107% + semi equipment power	Medium	Dual AI exposure: powers chip manufacturing + data centers. $1.80B rev, DC +107%. BofA pick.
BESI.AS	73	HOLD	N/A	N/A	N/A	Very Strong	Q4 orders +105% + hybrid bonding €476M by 2026	Medium	42% die-attach share + hybrid bonding pioneer. Equipment chokepoint for CPO/AI packaging. Near BUY.
KLIC	62	HOLD	N/A	N/A	N/A	Moderate	SiPh TCB orders + CoWoS qualification	Medium	#2 advanced packaging behind Besi. SiPh CPO bonding orders but less dominant position.
042700.KS	70	HOLD	N/A	N/A	N/A	Strong but Eroding	HBM TC bonder 71% share + CPO packaging entry	Medium	HBM-to-photonics bridge. 71% TC bonder share but SK Hynix diversifying. CPO expansion is new angle.
3105.TW	64	HOLD	N/A	N/A	N/A	Strong	GaAs foundry 50%+ share + AI/optical pivot	Medium	World's largest GaAs foundry. VCSELs for DC optical. Pivoting from mobile to AI. Taiwan-listed.
VNP.TO	61	HOLD	N/A	N/A	N/A	Moderate	Germanium grant + raw metals for photonics	Medium	Deepest upstream: ultra-high-purity In/Ga/Ge supplier. $391M rev +35%. +322% stock. Solar-focused.
PRY.MI	60	HOLD	N/A	N/A	N/A	Moderate	Hollow-core fiber + Relativity Networks partnership	Low	World's largest cable co. HCF 50% faster than conventional fiber. Long-term AI DC option.
VRT	72	HOLD	N/A	N/A	N/A	Strong	$15B backlog + NVIDIA cooling partner + orders +252%	Low	AI DC cooling/power backbone. Not photonics directly but demand confirmation. +62% YTD 2026.
6777.T	55	HOLD	N/A	N/A	N/A	Moderate	CPO tunable laser + MEMS tunable filters for 400G+	Medium	Japan micro-cap optical component niche. Tunable filters/WSS inside every coherent transceiver.
6869.HK	58	HOLD	N/A	N/A	N/A	Moderate	HollowBand HCF + AI x Fibre vision	Low	China #1, global #2 fiber cable. Hollow-core fiber innovation. Dual-listed HK+Shanghai.
CSCO	68	HOLD	N/A	N/A	N/A	Strong	$5B AI orders + Acacia coherent + Silicon One G300	Low	Sleeping AI optics giant; $1.2B+ AI optics but diluted by $250B enterprise. Acacia ~50% coherent share.
INTC	52	HOLD	N/A	N/A	N/A	Moderate	OCI chiplet pioneer + 8M PICs shipped	High	SiPh technology pioneer but company in crisis. Best-in-class OCI chiplet at 5pJ/bit. Wait for turnaround.
2317.TW	62	HOLD	N/A	N/A	N/A	Moderate	Cloud/networking 40% of rev + NVIDIA server assembly	Low	World's largest AI server maker. $248B rev at 0.24x sales. Broad AI hardware proxy, not photonics.
2382.TW	60	HOLD	N/A	N/A	N/A	Moderate	AI servers 70% of server rev + GB200 orders	Low	#2 AI server ODM. $60B rev, NVIDIA GB200 orders for MSFT/AMZN/GOOG/META. 0.5x sales.
5016.T	66	HOLD	N/A	N/A	N/A	Strong	Newly IPO'd InP substrate + 50% capacity expansion + non-China	Medium	JX Advanced Metals: Japan's largest IPO since SoftBank. 40yr InP expertise. Non-China AXT alternative.
MXL	60	HOLD	17.43	21.55	+24%	Moderate	Rushmore 1.6T DSP + Annapurna 224G retimer	High	Small-cap optical DSP turnaround. Right products but smallest competitor. Watch OFC 2026 wins.
SMTC	70	HOLD	78	N/A	N/A	Moderate-Strong	LPO disruption + FiberEdge TIA + CopperEdge ACC + DC +50%	Medium	Under-discovered LPO disruptor. Removing DSP from optical modules. Hyperscaler LPO design wins.
VECO	63	HOLD	N/A	N/A	N/A	Moderate-Strong	MOCVD duopoly + Lumina+ for photonics + Axcelis merger	Medium	MOCVD equipment leader; grows every InP/GaAs laser chip. Duopoly with Aixtron. Merging with Axcelis.
AIXA.DE	65	HOLD	N/A	N/A	N/A	Very Strong	70-90% MOCVD share + optoelectronics growth for AI	Medium	Dominant MOCVD duopoly partner. "Most underappreciated AI beneficiary." FY26 flat on SiC headwinds.
XFAB.PA	56	HOLD	N/A	N/A	N/A	Emerging	InP-on-Silicon heterogeneous integration + SiN photonics	Medium	European SiPh foundry with InP hetero integration (>120GHz). Early stage, production 2027. Niche.
6857.T	71	HOLD	N/A	N/A	N/A	Very Strong	V93000 SiPh + AI chip test + 30-40% growth + multiple raises	Low	ASML of testing. ¥1.07T revenue. V93000 extended to SiPh/CPO testing via FormFactor. Near BUY.
TER	72	HOLD	N/A	N/A	N/A	Strong	Quantifi Photonics acquisition + AI 70% of rev + compute +90%	Low	ATE duopoly #2. Acquired PIC testing leader. AI drives 70% of revenue. $3.19B rev. Near BUY.
3711.TW	70	HOLD	N/A	N/A	N/A	Strong	SiPh packaging platform + Lightmatter CPO + $300-400M SiPh rev	Medium	World #1 OSAT with dedicated SiPh packaging. CPO <5pJ/bit demo. Lightmatter 3D photonics partner.
AMKR	64	HOLD	N/A	N/A	N/A	Moderate	2.5D 3x growth + $7B Arizona campus + photonics team	Medium	#2 OSAT. 2.5D packaging nearly tripling in 2026. $7B US advanced packaging investment.
000936.SZ	54	HOLD	N/A	N/A	N/A	Moderate	Source Photonics ownership + optical transceivers	Medium	Owns Source Photonics (top-10 global transceiver). $850M cap. Opaque conglomerate structure.
3231.TW	62	HOLD	N/A	N/A	N/A	Moderate	NVIDIA booked capacity + $69B rev +108% + Blackwell/Rubin	Low	Fastest-growing Taiwan ODM +108%. NVIDIA locked entire plant. Broad AI server proxy.
NOK	60	HOLD	N/A	N/A	N/A	Moderate	€3.4B optical + Infinera InP + 70% TCO reduction	Low	Ciena competitor ~20% optical share. InP + SiPh coherent. Telecom conglomerate dilution.
300548.SZ	58	HOLD	N/A	N/A	N/A	Moderate	SiPh + PLC + transceiver packaging	Medium	Mid-tier Chinese optical component co. $2.68B cap, $274M rev. SiPh capability. Below Big 3.
0877.HK	56	HOLD	N/A	N/A	N/A	Moderate	Sivers/Enablence CPO ELS partnership	Medium	Chinese passive optical component layer. Amplifiers, isolators, filters. CPO ELS module partner.
STLTECH.NS	55	HOLD	N/A	N/A	N/A	Moderate	Optical interconnect +53% + DC fiber 76% CAGR	Medium	India's leading optical fiber co. $968M cap, $486M rev. Optical interconnect growing at 30% margins.
4991.TW	57	HOLD	N/A	N/A	N/A	Emerging	200G PD + CW laser ramp for SiPh + CPO	Medium	Taiwan optical component maker targeting SiPh/CPO. Both TX and RX components. 2026 mass production.
8258.TW	62	HOLD	N/A	N/A	N/A	Moderate	InP 200G PIN + EZconn CPO partnership + 53.8% growth	Medium	Taiwan InP epiwafer specialist. End-to-end CPO via EZconn. Fastest-growing Taiwan semi #3. Under-discovered.
UMC	59	HOLD	N/A	N/A	N/A	Emerging	imec iSiPP300 SiPh license + risk production 2026-27	Low	Taiwan #2 foundry entering SiPh. 3rd major foundry option vs Tower/GF. Long-term diversification play.
300394.SZ	64	HOLD	325	N/A	N/A	Moderate	Leading Chinese OSA/packaging for transceivers	Medium	Chinese Fabrinet: $35B cap, $662M rev. Optical sub-assembly bridge between components and modules.
000988.SZ	58	HOLD	45.15	N/A	N/A	Moderate	400G-1.6T transceivers + laser equipment + SiPh	Medium	China's first laser IPO. CNY 9B rev +23%. Optical comms division testing 1.6T with leading clients.
JEN.DE	50	AVOID	23.40	N/A	N/A	Moderate	Semi equipment photonics + industrial optical	Medium	German photonics co with €1.05B rev (-6%). Weak semi cycle. Not directly AI DC-focused.
STM	62	HOLD	N/A	N/A	N/A	Emerging	PIC100 SiPh in HV production + 4x capacity by 2027	Low	5th SiPh foundry entrant. PIC100 for 800G/1.6T. Quadrupling capacity. Diversified $13B semi co.
AMAT	65	HOLD	N/A	N/A	N/A	Strong	GF Singapore photonics fab + deposition tools in every SiPh fab	Low	#1 semi equipment co. Deposition essential for all SiPh manufacturing. Photonics is tiny fraction.
LRCX	63	HOLD	N/A	N/A	N/A	Strong	Etch tools for SiPh waveguide patterning	Low	#2 semi equipment. Etch tools define optical structures in every SiPh chip. Photonics tiny fraction.
ASML	68	HOLD	N/A	N/A	N/A	Exceptional	DUV lithography monopoly for SiPh + every new fab needs ASML	Low	Lithography monopoly. Every SiPh foundry expansion needs ASML DUV tools. $320B+ market cap context.
